objectid,title,collection_link,creator,date,date_range,description,subject,location,latitude,longitude,source,material_type,format,language,rights,rightsstatement,display_template,filename,identifier,object_location,image_small,image_thumb
meridian_001,Dairy Days Collection,https://historycenter.mld.org/dairy_days/,Meridian Library District,1950,1950-1951,The annual Dairy Days show celebrates Meridian's rich history as a dairy town. This is a collection of snapshots from the Dairy Days parade in 1950.,City and Town Life; Clubs and Societies; parades; floats; dairy,"Meridian, Idaho",43.61295245,-116.3907596,Meridian Library History Center,Documents; Photographs,image/jpg,eng,,"For educational and research use only. Copyright restrictions may apply. User is responsible for all copyright compliance. Please contact the History Center at history@mld.org or 208-888-4451, ext. 1023 for further information. The Meridian Library District is not liable for any violations of the law by users.",image,dairy-days.jpg,dairy-days,objects/dairy-days.jpg,objects/small/dairy-days_sm.jpg,objects/thumbs/dairy-days_th.jpg
meridian_003,Girl Graduate Album,https://historycenter.mld.org/girl_graduate/,Meridian Library District,1902,1902-1922,"This scrapbook chronicles the senior year of Meridian High School graduate, Ardath Lillian Caldwell. The collection documents milestones in Caldwell's life in the early 1920s.",City and Town Life; Clubs and Societies; families; schools,"Meridian, Idaho",43.61295245,-116.3907596,Meridian Library History Center,Documents; Photographs; Scrapbooks,image/jpg,eng,,"For educational and research use only. Copyright restrictions may apply. User is responsible for all copyright compliance. Please contact the History Center at history@mld.org or 208-888-4451, ext. 1023 for further information. The Meridian Library District is not liable for any violations of the law by users.",image,girl-graduate.jpg,girl-graduate,objects/girl-graduate.jpg,objects/small/girl-graduate_sm.jpg,objects/thumbs/girl-graduate_th.jpg
meridian_002,Mayes Gray Collection,https://historycenter.mld.org/mayes_gray/,Meridian Library District,1886,1886-1980,"The Mayes and Gray families are among the early settlers of Meridian, Idaho. The images in this digital collection range from 1890 to 1980 and are a wonderful snapshot into Meridian's past.",City and Town Life; Clubs and Societies; Home and Family; creamery; settlers; buildings,"Meridian, Idaho",43.61295245,-116.3907596,Meridian Library History Center,Photographs,image/jpg,eng,,"For educational and research use only. Copyright restrictions may apply. User is responsible for all copyright compliance. Please contact the History Center at history@mld.org or 208-888-4451, ext. 1023 for further information. The Meridian Library District is not liable for any violations of the law by users.",image,mayes-gray.jpg,mayes-gray,objects/mayes-gray.jpg,objects/small/mayes-gray_sm.jpg,objects/thumbs/mayes-gray_th.jpg
meridian_008,Meridian Library District History,https://historycenter.mld.org/mld/,Meridian Library District,1926,1926-2024,"The year 2024 marks 100 years of libraries in Meridian, Idaho. While the Meridian Occident Club ran the library from 1924-1974, in 1974 they turned over their library to the Ada County Commissioners to form the Meridian Library District. The Meridian Library District History collection looks at the past 50 years of MLD history. It cointains photographs and documents from past MLD scrapbooks, and a written 50 year history of MLD. The material on display provides insight into how MLD has served the residents of Meridian, Idaho. ","public libraries, public librarians","Meridian, Idaho",43.61295245,-116.3907596,Meridian Library History Center,"Documents; Photographs, Scrapbooks",image/jpg,eng,,"This item is protected by copyright and/or related rights. To request permission for educational, commercial, or other uses, contact the History Center at history@mld.org or 208-888-4451, ext. 1023 for further information. The Meridian Library District is not liable for any violations of the law by users.",image,mld.jpg,mld,objects/mld.org,objects.small/mld_sm.jpg,objects/thumbs/mld_th.jpg
meridian_005,Meridian Occident Club Collection,https://historycenter.mld.org/occident_club/,Meridian Library District,1924,1924-1996,"The Occident Club was a community service organization serving Meridian, Idaho from 1924-1996. Their longest lasting legacy is the creation of a Meridian Public Library. This collection contains digital scans of monthly club minutes, yearbooks, and photos.",Women; City and Town Life; Clubs and Societies; library; Occident Club; civic engagement; club meeting minutes; yearbooks,"Meridian, Idaho",43.61295245,-116.3907596,Meridian Library History Center,Documents; Photographs,image/jpg,eng,,"For educational and research use only. Copyright restrictions may apply. User is responsible for all copyright compliance. Please contact the History Center at history@mld.org or 208-888-4451, ext. 1023 for further information. The Meridian Library District is not liable for any violations of the law by users.",image,occident-club.jpg,occident-club,objects/occident-club.jpg,objects/small/occident-club_sm.jpg,objects/thumbs/occident-club_th.jpg
meridian_006,Meridian Police Department,https://historycenter.mld.org/meridianpolice/,Meridian Library District,1903,1903-2023,"The Meridian Police Department collection looks at the history of law enforcement in Meridian and their contributions to the community over the years. The collection ranges from 1903 to current and includes an overview of Meridian marshal and police chiefs, development of community programs such as Police Activities League (PALs) and Citizens on Patrol, the opening of the K9 facility in 2006, and a special contribution of digital images from the Chief Gene Hiner scrapbook that was donated to the Meridian Police Department from his family.",City and Town Life; Law Enforcement; Community Programs; K9 Units; Police Departments,"Meridian, Idaho",43.61295245,-116.3907596,Meridian Library History Center,Documents; Photographs,image/jpg,eng,,"This item is protected by copyright and/or related rights. To request permission for educational, commercial, or other uses, contact the History Center at history@mld.org or 208-888-4451, ext. 1023 for further information. The Meridian Library District is not liable for any violations of the law by users.",image,meridian-police.jpg,meridian-police,objects/meridian-police.jpg,objects/small/meridian-police_sm.jpg,objects/thumbs/meridian-police_th.jpg
meridian_004,Willett Family Photo Album,https://historycenter.mld.org/willett_album/,Meridian Library District,1905,1905-2014,"The Willett Family traveled from Bridgewater, Massachusetts to Meridian, Idaho in 1921 to visit their daughter. This photograph collection documents their six-week cross-country journey in an auto bungalow.",Expeditions and Adventure; Overland Journeys to the Western United States; families; travel; automobiles; auto bungalow; campgrounds,"Meridian, Idaho",43.61295245,-116.3907596,Meridian Library History Center,Documents; Photographs,image/jpg,eng,,"For educational and research use only. Copyright restrictions may apply. User is responsible for all copyright compliance. Please contact the History Center at history@mld.org or 208-888-4451, ext. 1023 for further information. The Meridian Library District is not liable for any violations of the law by users.",image,willett-family.jpg,willett-family,objects/willett-family.jpg,objects/small/willett-family_sm.jpg,objects/thumbs/willett-family_th.jpg